{
  "base_commit": "e6e574d2fd88a288cf84675c65b840cc35cf8564",
  "build_commands": [
    "mvn -B test"
  ],
  "case_id": "case_98657e7509ae2b67",
  "focal_file_path": "sslr-core/src/main/java/com/sonar/sslr/api/typed/ActionParser.java",
  "mapped_focal_method": "parse",
  "mapped_test_method": "unknown_file",
  "metadata": {
    "baseline_test_result_path": "C:\\Users\\osart\\OneDrive - Umich\\SWTProject\\Phase2_SWE_Testing\\phase2\\artifacts\\logs\\test_runs\\20260306T031619Z_4159017_test_run.json",
    "baseline_test_status": "error",
    "candidate_test_result_path": "C:\\Users\\osart\\OneDrive - Umich\\SWTProject\\Phase2_SWE_Testing\\phase2\\artifacts\\logs\\test_runs\\20260306T031633Z_4159017_test_run.json",
    "candidate_test_status": "error",
    "failures_appear": false,
    "human_update_commit": "a0916c96e1be9ae9560e0275699cfbc9939a9090",
    "human_update_distance": 0,
    "human_update_found": true,
    "rank": 1,
    "record_id": "c2t_02e1fc2854da3da2c6f7",
    "score": 5.0,
    "touches_method_region": true
  },
  "modified_commit": "a0916c96e1be9ae9560e0275699cfbc9939a9090",
  "repo_id": "4159017",
  "test_file_path": "sslr-core/src/test/java/com/sonar/sslr/api/typed/ActionParserTest.java"
}