{
  "base_commit": "e6e574d2fd88a288cf84675c65b840cc35cf8564",
  "build_commands": [
    "mvn -B test"
  ],
  "case_id": "case_362b2cdc1406b24a",
  "focal_file_path": "sslr-core/src/main/java/com/sonar/sslr/api/typed/Optional.java",
  "mapped_focal_method": "or",
  "mapped_test_method": "absent_or_null",
  "metadata": {
    "baseline_test_result_path": "C:\\Users\\osart\\OneDrive - Umich\\SWTProject\\Phase2_SWE_Testing\\phase2\\artifacts\\logs\\test_runs\\20260306T031924Z_4159017_test_run.json",
    "baseline_test_status": "error",
    "candidate_test_result_path": "C:\\Users\\osart\\OneDrive - Umich\\SWTProject\\Phase2_SWE_Testing\\phase2\\artifacts\\logs\\test_runs\\20260306T031932Z_4159017_test_run.json",
    "candidate_test_status": "error",
    "failures_appear": false,
    "human_update_commit": "19e68665097b5c1bfe861763b1bdbaa83b1b60f9",
    "human_update_distance": 0,
    "human_update_found": true,
    "rank": 1,
    "record_id": "c2t_06aa942f9a28e24ddfeb",
    "score": 3.0,
    "touches_method_region": false
  },
  "modified_commit": "19e68665097b5c1bfe861763b1bdbaa83b1b60f9",
  "repo_id": "4159017",
  "test_file_path": "sslr-core/src/test/java/com/sonar/sslr/api/typed/OptionalTest.java"
}